Series,Part Number,Name,USD Catalogue,USD Price,CAD Catalogue,CAD Price,Categories,Arm Type,Base Type,Back Material,Back Height,Tilter Prop,Images
Global Accord,2670-2,Upholstered High Back Knee-Tilter,GUS,1587,GLS,1185,Task Seating,With Arms,,Upholstered Back,High Back,Knee-Tilter,TRUE
Global Accord,2670-4,Upholstered High Back Tilter,GUS,1304,GLS,1027,Task Seating,With Arms,,Upholstered Back,High Back,Tilter,TRUE
Global Accord,2671-2,Upholstered Medium Back Knee-Tilter,GUS,1546,GLS,1147,Task Seating,With Arms,,Upholstered Back,Medium Back,Knee-Tilter,TRUE
Global Accord,2671-4,Upholstered Medium Back Tilter,GUS,1264,GLS,988,Task Seating,With Arms,,Upholstered Back,Medium Back,Tilter,TRUE
Global Accord,2672-6,Upholstered Medium Back Stool,GUS,1552,GLS,1177,Stools,With Arms,,Upholstered Back,Medium Back,    ,TRUE
Global Accord,2676-2,Mesh High Back Knee-Tilter,GUS,1718,GLS,1322,Task Seating,With Arms,,Mesh Back,High Back,Knee-Tilter,TRUE
Global Accord,2676-4,Mesh High Back Tilter,GUS,1436,GLS,1164,Task Seating,With Arms,,Mesh Back,High Back,Tilter,TRUE
Global Accord,2677-2,Mesh Medium Back Knee-Tilter,GUS,1663,GLS,1269,Task Seating,With Arms,,Mesh Back,Medium Back,Knee-Tilter,TRUE
Global Accord,2677-4,Mesh Medium Back Tilter,GUS,1380,GLS,1110,Task Seating,With Arms,,Mesh Back,Medium Back,Tilter,TRUE
Global Accord,2678-6,Mesh Medium Back Stool,GUS,1651,GLS,1297,Stools,With Arms,,Mesh Back,Medium Back,    ,TRUE
Global Accord,2670-4PB,"Upholstered High Back Tilter, Pedestal Base",GUS,1536,GLS,1256,Pedestal,With Arms,Pedestal Base,Upholstered Back,High Back,Tilter,TRUE
Global Accord,2671-4PB,"Upholstered Medium Back Tilter, Pedestal Base ",GUS,1495,GLS,1218,Pedestal,With Arms,Pedestal Base,Upholstered Back,Medium Back,Tilter,TRUE
Global Accord,2676-4PB,"Mesh High Back Tilter, Pedestal Base",GUS,1667,GLS,1394,Pedestal,With Arms,Pedestal Base,Mesh Back,High Back,Tilter,TRUE
Global Accord,2677-4PB,"Mesh Medium Back Tilter, Pedestal Base",GUS,1611,GLS,1338,Pedestal,With Arms,Pedestal Base,Mesh Back,Medium Back,Tilter,TRUE
Luray,6460,Upholstered Extended High Back,GUS,1287,GLS,1017,Task Seating,With Arms,,Upholstered Back,Extended High Back,    ,TRUE
Luray,6461,Upholstered High Back,GUS,1249,GLS,984,Task Seating,With Arms,,Upholstered Back,High Back,    ,TRUE
Luray,6462,Upholstered Medium Back,GUS,1211,GLS,952,Task Seating,With Arms,,Upholstered Back,Medium Back,    ,TRUE
Luray,6460PB,"Extended High Back, Pedestal Base",GUS,1517,GLS,1226,Pedestal,With Arms,Pedestal Base,    ,Extended High Back,    ,TRUE
Luray,6461PB,"High Back, Pedestal Base",GUS,1480,GLS,1193,Pedestal,With Arms,Pedestal Base,    ,High Back,    ,TRUE
Luray,6462PB,"Medium Back, Pedestal Base",GUS,1441,GLS,1159,Pedestal,With Arms,Pedestal Base,    ,Medium Back,    ,TRUE
Solar,8456,"Medium Back Mesh Tilter, Asphalt Frame",GUS,1088,GLS,1012,Task Seating,With Arms,,Mesh Back,Medium Back,Tilter,TRUE
Solar,8456NA,"Armless Mesh Seat & Back Tilter, Asphalt Frame",GUS,1044,GLS,962,Task Seating,Armless,,Mesh Back,    ,Tilter,TRUE
Solar,8456S,"Mesh Seat & Back Stool, Asphalt Frame",GUS,1387,GLS,1170,Stools,With Arms,,Mesh Back,    ,    ,TRUE
Solar,8456SNA,"Armless Mesh Seat & Back Stool, Asphalt Frame ",GUS,1343,GLS,1111,Stools,Armless,,Mesh Back,    ,    ,TRUE
Solar,8457,"Mesh Seat & Back Tilter, Alabaster Frame",GUS,1193,GLS,1121,Task Seating,With Arms,,Mesh Back,    ,Tilter,TRUE
Solar,8457NA,"Armless Mesh Seat & Back Tilter, Alabaster Frame",GUS,1150,GLS,1065,Task Seating,Armless,,Mesh Back,    ,Tilter,TRUE
Solar,8457S,"Mesh Seat & Back Stool, Alabaster Frame",GUS,1492,GLS,1274,Stools,With Arms,,Mesh Back,    ,    ,TRUE
Solar,8457SNA,"Armless Mesh Seat & Back Stool, Alabaster Frame",GUS,1448,GLS,1211,Stools,Armless,,Mesh Back,    ,    ,TRUE
Prefer,8458,"Multi-Task Chair, Asphalt Frame & Base",GUS,1234,GLS,1163,Task Seating,With Arms,,    ,    ,    ,TRUE
Prefer,8458NA,"Armless Multi-Task Chair, Asphalt Frame & Base",GUS,1080,GLS,1059,Task Seating,Armless,,    ,    ,    ,TRUE
Prefer,8458S,"Height Adjustable Stool, Asphalt Frame & Base",GUS,1420,GLS,1340,Stools,With Arms,,    ,    ,    ,TRUE
Prefer,8458NAS,"Armless Height Adjustable Stool, Asphalt Frame & Base",GUS,1294,GLS,1238,Stools,Armless,,    ,    ,    ,TRUE
Prefer,8459,"Multi-Task Chair, Alabaster Frame & Base",GUS,1294,GLS,1196,Task Seating,With Arms,,    ,    ,    ,TRUE
Prefer,8459NA,"Armless Multi-Task Chair, Alabaster Frame & Base",GUS,1185,GLS,1094,Task Seating,Armless,,    ,    ,    ,TRUE
Prefer,8459S,"Height Adjustable Stool, Alabaster Frame & Base",GUS,1480,GLS,1374,Stools,With Arms,,    ,    ,    ,TRUE
Prefer,8459NAS,"Armless Height Adjustable Stool, Alabaster Frame & Base",GUS,1360,GLS,1271,Stools,Armless,,    ,    ,    ,TRUE
Kate,2811-4,Medium Back Tilter,GUS,1412,GLS,1187,Task Seating,With Arms,,    ,Medium Back,Tilter,TRUE
Kate,2811-8,Medium Back Swivel,GUS,1362,GLS,1161,Task Seating,With Arms,,    ,Medium Back,    ,TRUE
Kate,2813,Medium Back Armchair,GUS,1543,GLS,1128,Side Chair,With Arms,,    ,Medium Back,    ,TRUE
Kate,2814,Ottoman ,GUS,966,GLS,740,Bench,Armless,,    ,No Back,    ,TRUE
Roma,1876,Mesh Medium Back Height Adjustable Stool with Arms,GUS,1174,GLS,908,Stools,With Arms,,Mesh Back,Medium Back,    ,TRUE
Roma,1879,Honeycomb Polypropylene Medium Back Height Adjustable Stool with Arms,GUS,1217,GLS,938,Stools,With Arms,,Polypropylene Back,Medium Back,    ,TRUE
Roma,1897,Honeycomb Polypropylene Medium Back with Arms,GUS,952,GLS,828,Task Seating,With Arms,,Polypropylene Back,Medium Back,    ,TRUE
Roma,1898,Honeycomb Polypropylene Medium Back Nesting Chair with Arms,GUS,785,GLS,684,Side Chair,With Arms,,Polypropylene Back,Medium Back,    ,TRUE
Roma,1899,Mesh Medium Back Nesting Chair with Arms,GUS,773,GLS,654,Side Chair,With Arms,,Mesh Back,Medium Back,    ,TRUE
Roma,1900,Flexible Polypropylene Medium Back Nesting Chair with Arms,GUS,773,GLS,654,Side Chair,With Arms,,Polypropylene Back,Medium Back,    ,TRUE
Roma,1901,"Mesh Medium Back, Armless",GUS,891,GLS,716,Task Seating,Armless,,Mesh Back,Medium Back,    ,TRUE
Roma,1902,"Flexible Polypropylene Medium Back, Armless",GUS,891,GLS,716,Task Seating,Armless,,Polypropylene Back,Medium Back,    ,TRUE
Roma,1903,"Upholstered Medium Back, Armless",GUS,960,GLS,799,Task Seating,Armless,,Upholstered Back,Medium Back,    ,TRUE
Roma,1906,Mesh Medium Back with Arms,GUS,952,GLS,799,Task Seating,With Arms,,Mesh Back,Medium Back,    ,TRUE
Roma,1907,Flexible Polypropylene Medium Back with Arms,GUS,952,GLS,799,Task Seating,With Arms,,Polypropylene Back,Medium Back,    ,TRUE
Roma,1908,Upholstered Medium Back with Arms,GUS,1023,GLS,855,Task Seating,With Arms,,Upholstered Back,Medium Back,    ,TRUE
Graphic,2736,"Nylon Posture Back, Armless",GUS,735,GLS,624,Task Seating,Armless,,    ,    ,    ,TRUE
Graphic,2736MB,"Mesh Posture Back, Armless",GUS,815,GLS,732,Task Seating,Armless,,Mesh Back,    ,    ,TRUE
Graphic,2737,"Upholstered Posture Back, Armles",GUS,815,GLS,697,Task Seating,With Arms,,Upholstered Back,    ,    ,TRUE
Graphic,2738,"Nylon Posture Back, Armless",GUS,815,GLS,724,Task Seating,Armless,,    ,    ,    ,TRUE
Graphic,2738MB,"Mesh Posture Back, Armless",GUS,899,GLS,829,Task Seating,Armless,,Mesh Back,    ,    ,TRUE
Graphic,2739,"Upholstered Posture Back, Armles",GUS,899,GLS,794,Task Seating,With Arms,,Upholstered Back,    ,    ,TRUE
Graphic,2748,Nylon Posture Back Stool,GUS,1028,GLS,966,Stools,With Arms,,    ,    ,    ,TRUE
Synopsis,5080-0,High Back Synchro-Tilter,GUS,1203,GLS,1129,Task Seating,With Arms,,    ,High Back,Synchro-Tilter,TRUE
Synopsis,5080-3,High Back Multi-Tilter ,GUS,1203,GLS,1129,Task Seating,With Arms,,    ,High Back,Multi-Tilter,TRUE
Synopsis,5081-0,Medium Back Synchro-Tilter,GUS,1088,GLS,1073,Task Seating,With Arms,,    ,Medium Back,Synchro-Tilter,TRUE
Synopsis,5081-3,Medium Back Multi-Tilter,GUS,1088,GLS,1073,Task Seating,With Arms,,    ,Medium Back,Multi-Tilter,TRUE
Synopsis,5090-4,High Back Tilter,GUS,752,GLS,814,Task Seating,With Arms,,    ,High Back,Tilter,TRUE
Synopsis,5091-4,Medium Back Tilter,GUS,705,GLS,780,Task Seating,With Arms,,    ,Medium Back,Tilter,TRUE
Synopsis,5092,Armchair ,GUS,715,GLS,734,Side Chair,With Arms,,    ,    ,    ,TRUE
Synopsis,5090-4PB,"High Back Tilter, Pedestal Base ",GUS,983,GLS,1023,Pedestal,With Arms,Pedestal Base,    ,High Back,Tilter,TRUE
Synopsis,5091-4PB,"Medium Back Tilter, Pedestal Base",GUS,937,GLS,987,Pedestal,With Arms,Pedestal Base,    ,Medium Back,Tilter,TRUE
Tritek Ergo Select,7471-3,"Extended High Back Multi-Tilter, Small Seat ",,,GLS,1317,Task Seating,With Arms,,    ,Extended High Back,Multi-Tilter,TRUE
Tritek Ergo Select,7472-3,"Extended High Back Multi-Tilter, Standard Seat",,,GLS,1317,Task Seating,With Arms,,    ,Extended High Back,Multi-Tilter,TRUE
Tritek Ergo Select,7473-3,"Extended High Back Multi-Tilter, Generous Seat",,,GLS,1317,Task Seating,With Arms,,    ,Extended High Back,Multi-Tilter,TRUE
Tritek Ergo Select,7481-3,"High Back Multi-Tilter, Small Seat",,,GLS,1281,Task Seating,With Arms,,    ,High Back,Multi-Tilter,TRUE
Tritek Ergo Select,7482-3,"High Back Multi-Tilter, Standard Seat",,,GLS,1281,Task Seating,With Arms,,    ,High Back,Multi-Tilter,TRUE
Tritek Ergo Select,7483-3,"High Back Multi-Tilter, Generous Seat",,,GLS,1281,Task Seating,With Arms,,    ,High Back,Multi-Tilter,TRUE
Tritek Ergo Select,7491-3,"Medium Back Multi-Tilter, Small Seat",,,GLS,1242,Task Seating,With Arms,,    ,Medium Back,Multi-Tilter,TRUE
Tritek Ergo Select,7492-3,"Medium Back Multi-Tilter, Standard Seat",,,GLS,1242,Task Seating,With Arms,,    ,Medium Back,Multi-Tilter,TRUE
Tritek Ergo Select,7493-3,"Medium Back Multi-Tilter, Generous Seat",,,GLS,1242,Task Seating,With Arms,,    ,Medium Back,Multi-Tilter,TRUE
Auburn,3767,High Back Tilter,GUS,1745,GLS,1394,Task Seating,With Arms,,    ,High Back,Tilter,TRUE
Arturo,3991,Extended High Back Tilter,GUS,1539,GLS,1407,Task Seating,With Arms,,    ,Extended High Back,Tilter,TRUE
Arturo,3992,High Back Tilter ,GUS,1424,GLS,1347,Task Seating,With Arms,,    ,High Back,Tilter,TRUE
Arturo,3993,Low Back Tilter,GUS,1370,GLS,1300,Task Seating,With Arms,,    ,Low Back,Tilter,TRUE
Concorde,2400-18,High Back Executive Multi-Tilter,GUS,4273,GLS,3392,Task Seating,With Arms,,    ,High Back,Multi-Tilter,TRUE
Concorde,2409,High Back Presidential Synchro-Tilter,GUS,7009,GLS,4567,Task Seating,With Arms,,    ,High Back,Synchro-Tilter,TRUE
Concorde,2424,High Back 24HR Executive Synchro-Tilter,GUS,3199,GLS,2716,Task Seating,With Arms,,    ,High Back,Synchro-Tilter,TRUE
Concorde,2424-18,"High Back 24HR Executive Synchro-Tilter, Deep Seat",GUS,3251,GLS,2716,Task Seating,With Arms,,    ,High Back,Synchro-Tilter,TRUE
Solo,5225,Armchair ,GUS,427,GLS,328,Side Chair,With Arms,,    ,    ,    ,TRUE
Solo,5227,High Back Tilter,GUS,629,GLS,468,Task Seating,With Arms,,    ,High Back,Tilter,TRUE
Solo,5228,Low Back Tilter,GUS,565,GLS,427,Task Seating,With Arms,,    ,Low Back,Tilter,TRUE
Enterprise,4560,High Back Tilter,GUS,694,GLS,775,Side Chair,With Arms,,    ,High Back,Tilter,TRUE
Enterprise,4561,Medium Back Tilter,GUS,663,GLS,743,Side Chair,With Arms,,    ,Medium Back,Tilter,TRUE
Enterprise,4565,Cantilever Armchair,GUS,663,GLS,698,Side Chair,With Arms,,    ,    ,    ,TRUE
Enterprise,4570-3,High Back Multi-Tilter,GUS,1269,GLS,1129,Task Seating,With Arms,,    ,High Back,Multi-Tilter,TRUE
Enterprise,4571-3,Medium Back Multi-Tilter,GUS,1142,GLS,1073,Task Seating,With Arms,,    ,Medium Back,Multi-Tilter,TRUE
Supra,5330-2,High Back Knee-Tilter,GUS,956,GLS,886,Task Seating,With Arms,,    ,High Back,Knee-Tilter,TRUE
Supra,5330-4,High Back Tilter,GUS,725,GLS,649,Task Seating,With Arms,,    ,High Back,Tilter,TRUE
Supra,5331-2,Medium Back Knee Tilter,GUS,906,GLS,845,Task Seating,With Arms,,    ,Medium Back,Tilter,TRUE
Supra,5331-4,Medium Back Tilter,GUS,678,GLS,609,Task Seating,With Arms,,    ,Medium Back,Tilter,TRUE
Supra,5332,Armchair ,GUS,565,GLS,495,Side Chair,With Arms,,    ,    ,    ,TRUE
Supra,5332C,"Armchair, Casters",GUS,744,GLS,588,Side Chair,With Arms,,    ,    ,    ,TRUE
Supra,5335,Cantilever Armchair,GUS,678,GLS,609,Side Chair,With Arms,,    ,    ,    ,TRUE
Traditional,3720,Queen Anne Style High Back Tilter ,,,GLS,1581,Task Seating,With Arms,,    ,High Back,Tilter,TRUE
Traditional,3722,Banker's Style Armchair ,GUS,1650,GLS,817,Side Chair,With Arms,,    ,    ,    ,TRUE
Traditional,3742,Martha Washington Style Low Back Armchair ,GUS,829,GLS,1110,Side Chair,With Arms,,    ,Low Back,    ,TRUE
Noetic,6070,Mesh Back Multi-Tilter,GUS,1248,GLS,1144,Task Seating,With Arms,,Mesh Back,    ,Multi-Tilter,TRUE
Noetic,6070NA,Armless Mesh Back Multi-Tilter,GUS,945,GLS,973,Task Seating,Armless,,Mesh Back,    ,Multi-Tilter,TRUE
Noetic,6071,Upholstered Back Multi-Tilter,GUS,817,GLS,1359,Task Seating,With Arms,,Upholstered Back,    ,Multi-Tilter,TRUE
Noetic,6071NA,Armless Upholstered Back Multi-Tilter ,GUS,1132,GLS,1189,Task Seating,Armless,,Upholstered Back,    ,Multi-Tilter,TRUE
Noetic,6072,Mesh Back Task Basic Swivel,GUS,997,GLS,1025,Task Seating,With Arms,Swivel Base,Mesh Back,    ,    ,TRUE
Noetic,6072NA,Armless Mesh Back Task Basic Swivel,GUS,861,GLS,855,Task Seating,Armless,Swivel Base,Mesh Back,    ,    ,TRUE
Noetic,6073,Upholstered Back Task Basic Swivel ,GUS,741,GLS,1240,Task Seating,With Arms,Swivel Base,Upholstered Back,    ,    ,TRUE
Noetic,6073NA,Armless Upholstered Back Task Basic Swivel,GUS,1041,GLS,1070,Task Seating,Armless,Swivel Base,Upholstered Back,    ,    ,TRUE
Noetic,6074,Mesh Back Weight Sensing Synchro-Tilter ,GUS,928,GLS,1090,Task Seating,With Arms,,Mesh Back,    ,Synchro-Tilter,TRUE
Noetic,6074NA,Armless Mesh Back Weight Sensing Synchro-Tilter,GUS,916,GLS,920,Task Seating,Armless,,Mesh Back,    ,Synchro-Tilter,TRUE
Noetic,6075,Upholstered Back Weight Sensing Synchro-Tilter,GUS,798,GLS,1307,Task Seating,With Arms,,Upholstered Back,    ,Synchro-Tilter,TRUE
Noetic,6075NA,Armless Upholstered Back Weight Sensing Synchro-Tilter,GUS,1096,GLS,1135,Task Seating,Armless,,Upholstered Back,    ,Synchro-Tilter,TRUE
Noetic,6076,Mesh Back Height Adjustable Stool ,GUS,984,GLS,1240,Stools,With Arms,,Mesh Back,    ,    ,TRUE
Noetic,6076NA,Armless Mesh Back Height Adjustable Stool,GUS,1041,GLS,1069,Stools,Armless,,Mesh Back,    ,    ,TRUE
Noetic,6077,Upholstered Back Height Adjustable Stool,GUS,897,GLS,1455,Stools,With Arms,,Upholstered Back,    ,    ,TRUE
Noetic,6077NA,Armless Upholstered Back Height Adjustable Stool,GUS,1221,GLS,1284,Stools,Armless,,Upholstered Back,    ,    ,TRUE
Vion,6321-0,Mesh High Back Synchro-Tilter,GUS,1078,GLS,1100,Task Seating,With Arms,,Mesh Back,High Back,Synchro-Tilter,TRUE
Vion,6321-3,Mesh High Back Multi-Tilter ,GUS,998,GLS,1100,Task Seating,With Arms,,Mesh Back,High Back,Multi-Tilter,TRUE
Vion,6321-4,Mesh High Back Tilter,GUS,998,GLS,1063,Task Seating,With Arms,,Mesh Back,High Back,Tilter,TRUE
Vion,6321-6,Mesh High Back Task,GUS,893,GLS,937,Task Seating,With Arms,,Mesh Back,High Back,    ,TRUE
Vion,6321-8,Mesh High Back Weight Sensing Synchro-Tilter ,GUS,856,GLS,1100,Task Seating,With Arms,,Mesh Back,High Back,Synchro-Tilter,TRUE
Vion,6322-0,Mesh Medium Back Synchro-Tilter,GUS,998,GLS,1041,Task Seating,With Arms,,Mesh Back,Medium Back,Synchro-Tilter,TRUE
Vion,6322-3,Mesh Medium Back Multi-Tilter,GUS,945,GLS,1041,Task Seating,With Arms,,Mesh Back,Medium Back,Multi-Tilter,TRUE
Vion,6322-4,Mesh Medium Back Tilter ,GUS,945,GLS,1003,Task Seating,With Arms,,Mesh Back,Medium Back,Tilter,TRUE
Vion,6322-6,Mesh Medium Back Task,GUS,840,GLS,877,Task Seating,With Arms,,Mesh Back,Medium Back,    ,TRUE
Vion,6322-8,Mesh Medium Back Weight Sensing Synchro-Tilter,GUS,812,GLS,1041,Task Seating,With Arms,,Mesh Back,Medium Back,Synchro-Tilter,TRUE
Vion,6323-6,Armless Mesh Medium Back Task,GUS,945,GLS,705,Task Seating,Armless,,Mesh Back,Medium Back,    ,TRUE
Vion,6331-0,Upholstered High Back Synchro-Tilter,GUS,767,GLS,1100,Task Seating,With Arms,,Upholstered Back,High Back,Synchro-Tilter,TRUE
Vion,6331-3,Upholstered High Back Multi-Tilter ,GUS,1131,GLS,1100,Task Seating,With Arms,,Upholstered Back,High Back,Multi-Tilter,TRUE
Vion,6331-4,Upholstered High Back Tilter,GUS,1131,GLS,1063,Task Seating,With Arms,,Upholstered Back,High Back,Tilter,TRUE
Vion,6331-6,Upholstered High Back Task,GUS,1011,GLS,937,Task Seating,With Arms,,Upholstered Back,High Back,    ,TRUE
Vion,6331-8,Upholstered High Back Weight Sensing Synchro-Tilter,GUS,982,GLS,1100,Task Seating,With Arms,,Upholstered Back,High Back,Synchro-Tilter,TRUE
Vion,6332-0,Upholstered Medium Back Synchro-Tilter,GUS,1131,GLS,1041,Task Seating,With Arms,,Upholstered Back,Medium Back,Synchro-Tilter,TRUE
Vion,6332-3,Upholstered Medium Back Multi-Tilter ,GUS,1079,GLS,1041,Task Seating,With Arms,,Upholstered Back,Medium Back,Multi-Tilter,TRUE
Vion,6332-4,Upholstered Medium Back Tilter,GUS,1079,GLS,1003,Task Seating,With Arms,,Upholstered Back,Medium Back,Tilter,TRUE
Vion,6332-6,Upholstered Medium Back Task,GUS,966,GLS,877,Task Seating,With Arms,,Upholstered Back,Medium Back,    ,TRUE
Vion,6332-8,Upholstered Medium Back Weight Sensing Synchro-Tilter,GUS,939,GLS,1041,Task Seating,With Arms,,Upholstered Back,Medium Back,Synchro-Tilter,TRUE
Vion,6333-6,Armless Upholstered Medium Back Task,GUS,1079,GLS,705,Task Seating,Armless,,Upholstered Back,Medium Back,    ,TRUE
Vion,GC6322-0,Mesh Medium Back Synchro-Tilter,GUS,893,GC1,1029,Task Seating,With Arms,,Mesh Back,Medium Back,Synchro-Tilter,TRUE
Vion,GC6322-4,Mesh Medium Back Tilter,GLC,1188,GC1,995,Task Seating,With Arms,,Mesh Back,Medium Back,Tilter,TRUE
Vion,GC6331-0,Upholstered High Back Synchro-Tilter ,GLC,1388,GC1,1083,Task Seating,With Arms,,Upholstered Back,High Back,Synchro-Tilter,TRUE
Vion,GC6331-4,Upholstered High Back Tilter,GLC,1213,GC1,1057,Task Seating,With Arms,,Upholstered Back,High Back,Tilter,TRUE
Vion,6324,Armless Mesh Low Back Side Chair,GUS,626,GLS,576,Side Chair,Armless,,Mesh Back,Low Back,    ,TRUE
Vion,6324C,"Armless Mesh Low Back Side Chair, Casters",GUS,626,GLS,672,Side Chair,Armless,,Mesh Back,Low Back,    ,TRUE
Vion,6325,Mesh Low Back Armchair,GUS,699,GLS,625,Side Chair,With Arms,,Mesh Back,Low Back,    ,TRUE
Vion,6325C,"Mesh Low Back Armchair, Casters",GUS,671,GLS,719,Side Chair,With Arms,,Mesh Back,Low Back,    ,TRUE
Vion,6334,Armless Upholstered Low Back Side Chair ,GUS,742,GLS,576,Side Chair,Armless,,Upholstered Back,Low Back,    ,TRUE
Vion,6334C,"Armless Upholstered Low Back Side Chair, Casters",GUS,685,GLS,672,Side Chair,Armless,,Upholstered Back,Low Back,    ,TRUE
Vion,6335,Upholstered Low Back Armchair,GUS,766,GLS,625,Side Chair,With Arms,,Upholstered Back,Low Back,    ,TRUE
Vion,6335C,"Upholstered Low Back Armchair, Casters",GUS,731,GLS,719,Side Chair,With Arms,,Upholstered Back,Low Back,    ,TRUE
Vion,6321-4PB,"Mesh High Back Tilter, Pedestal Base ",GUS,810,GLS,1291,Pedestal,With Arms,Pedestal Base,Mesh Back,High Back,Tilter,TRUE
Vion,6322-4PB,"Mesh Medium Back Tilter, Pedestal Base",GUS,1124,GLS,1230,Pedestal,With Arms,Pedestal Base,Mesh Back,Medium Back,Tilter,TRUE
Vion,6331-4PB,"Upholstered High Back Tilter, Pedestal Base",GUS,1072,GLS,1291,Pedestal,With Arms,Pedestal Base,Upholstered Back,High Back,Tilter,TRUE
Vion,6332-4PB,"Upholstered Medium Back Tilter, Pedestal Base",GUS,1242,GLS,1230,Pedestal,With Arms,Pedestal Base,Upholstered Back,Medium Back,Tilter,TRUE
Vion,6364-6PB,"Armless Mesh Low Back Task, Pedestal Base",GUS,1197,GLS,1031,Pedestal,Armless,Pedestal Base,Mesh Back,Low Back,    ,TRUE
Vion,6364-6LPB,"Armless Mesh Low Back Task with Left Tablet, Pedestal Base",GUS,1130,GLS,1307,Pedestal,Armless,Pedestal Base,Mesh Back,Low Back,    ,TRUE
Vion,6364-6RPB,"Armless Mesh Low Back Task with Right Tablet, Pedestal Base",GUS,1453,GLS,1307,Pedestal,Armless,Pedestal Base,Mesh Back,Low Back,    ,TRUE
Vion,6374-6PB,"Armless Upholstered Low Back Task, Pedestal Base",GUS,1453,GLS,1031,Pedestal,Armless,Pedestal Base,Upholstered Back,Low Back,    ,TRUE
Vion,6374-6LPB,"Armless Upholstered Low Back Task with Left Tablet, Pedestal Base",GUS,1130,GLS,1307,Pedestal,Armless,Pedestal Base,Upholstered Back,Low Back,    ,TRUE
Vion,6374-6RPB,"Armless Upholstered Low Back Task with Right Tablet, Pedestal Base",GUS,1453,GLS,1307,Pedestal,Armless,Pedestal Base,Upholstered Back,Low Back,    ,TRUE
Vion,S6328-6,Mesh Medium Back Heavy Duty Height Adjustable Stool,GUS,1453,GLS,1194,Task Seating,With Arms,,Mesh Back,Medium Back,    ,TRUE
Vion,S6338-6,Upholstered Medium Back Heavy Duty Height Adjustable Stool,GUS,999,GLS,1194,Task Seating,With Arms,,Upholstered Back,Medium Back,    ,TRUE
Vion,TS6321-3,Mesh High Back Heavy Duty Multi-Tilter,GUS,1122,GLS,1340,Task Seating,With Arms,,Mesh Back,High Back,Multi-Tilter,TRUE
Vion,TS6322-3,Mesh Medium Back Heavy Duty Multi-Tilter,GUS,1293,GLS,1279,Task Seating,With Arms,,Mesh Back,Medium Back,Multi-Tilter,TRUE
Vion,TS6331-3,Upholstered High Back Heavy Duty Multi-Tilter,GUS,1242,GLS,1340,Task Seating,With Arms,,Upholstered Back,High Back,Multi-Tilter,TRUE
Vion,TS6332-3,Upholstered Medium Back Heavy Duty Multi-Tilter,GUS,1427,GLS,1279,Task Seating,With Arms,,Upholstered Back,Medium Back,Multi-Tilter,TRUE
Vion,6327-6,Armless Mesh Medium Back Height Adjustable Stool,GUS,1376,GLS,922,Stools,Armless,,Mesh Back,Medium Back,    ,TRUE
Vion,6328-6,Mesh Medium Back Height Adjustable Stool,GUS,856,GLS,1094,Stools,With Arms,,Mesh Back,Medium Back,    ,TRUE
Vion,6337-6,Armless Upholstered Medium Back Height Adjustable Stool,GUS,966,GLS,922,Stools,Armless,,Upholstered Back,Medium Back,    ,TRUE
Vion,6338-6,Upholstered Medium Back Height Adjustable Stool,GUS,966,GLS,1094,Stools,With Arms,,Upholstered Back,Medium Back,    ,TRUE
Vion,6350,Mesh Back Bar Height Stool,GUS,1085,GLS,825,Stools,With Arms,,Mesh Back,    ,    ,TRUE
Vion,6351,Armless Mesh Back Bar Height Stool,GUS,871,GLS,777,Stools,Armless,,Mesh Back,    ,    ,TRUE
Vion,6352,Mesh Back Counter Height Stool,GUS,829,GLS,825,Stools,With Arms,,Mesh Back,    ,    ,TRUE
Vion,6353,Armless Mesh Back Counter Height Stool,GUS,871,GLS,777,Stools,Armless,,Mesh Back,    ,    ,TRUE
Vion,6360,Upholstered Back Bar Height Stool,GUS,829,GLS,825,Stools,With Arms,,Upholstered Back,    ,    ,TRUE
Vion,6361,Armless Upholstered Back Bar Height Stool,GUS,949,GLS,777,Stools,Armless,,Upholstered Back,    ,    ,TRUE
Vion,6362,Upholstered Back Counter Height Stool,GUS,907,GLS,825,Stools,With Arms,,Upholstered Back,    ,    ,TRUE
Vion,6363,Armless Upholstered Back Counter Height Stool,GUS,949,GLS,777,Stools,Armless,,Upholstered Back,    ,    ,TRUE
Factor,5540,High Back,GUS,907,GLS,695,Task Seating,With Arms,,    ,High Back,    ,TRUE
Factor,5540NA,"High Back, Armless",GUS,715,GLS,632,Task Seating,Armless,,    ,High Back,    ,TRUE
Factor,5541,Medium Back,GUS,667,GLS,684,Task Seating,With Arms,,    ,Medium Back,    ,TRUE
Factor,5541NA,"Medium Back, Armless",GUS,674,GLS,620,Task Seating,Armless,,    ,Medium Back,    ,TRUE
Factor,5546,Medium Back Stool,GUS,626,GLS,872,Stools,With Arms,,    ,Medium Back,    ,TRUE
Factor,5546NA,"Medium Back Stool, Armless",GUS,831,GLS,810,Stools,Armless,,    ,Medium Back,    ,TRUE
Factor,5545AM,Mesh Back Armchair,GUS,782,GLS,592,Side Chair,With Arms,,Mesh Back,    ,    ,TRUE
Factor,5545AMC,"Mesh Back Armchair, Casters",GUS,635,GLS,672,Side Chair,With Arms,,Mesh Back,    ,    ,TRUE
Factor,5545NM,Armless Mesh Back Chair ,GUS,729,GLS,546,Side Chair,Armless,,Mesh Back,    ,    ,TRUE
Factor,5545NMC,"Armless Mesh Back Chair, Casters",GUS,589,GLS,626,Side Chair,Armless,,Mesh Back,    ,    ,TRUE
Sora,6941,High Back Weight Sensing Synchro-Tilter,GUS,684,GLS,1140,Task Seating,With Arms,,    ,High Back,Synchro-Tilter,TRUE
Sora,6942,Medium Back Weight Sensing Synchro-Tilter ,GUS,1373,GLS,1113,Task Seating,With Arms,,    ,Medium Back,Synchro-Tilter,TRUE
G1 Ergo Select,7331,Medium Back,GUS,1319,GLS,1099,Task Seating,With Arms,,    ,Medium Back,    ,TRUE
G1 Ergo Select,7332,High Back,GUS,1296,GLS,1124,Task Seating,With Arms,,    ,High Back,    ,TRUE
G1 Ergo Select,7333,Extended High Back,GUS,1368,GLS,1149,Task Seating,With Arms,,    ,Extended High Back,    ,TRUE
G1 Ergo Select,7336,Medium Back Stool,GUS,1437,GLS,1273,Stools,With Arms,,    ,Medium Back,    ,TRUE
G1 Ergo Select,7336NA,Armless Medium Back Stool,GUS,1401,GLS,1211,Stools,Armless,,    ,Medium Back,    ,TRUE
G1 Ergo Select,TS7331,Medium Back Heavy Duty,GUS,1296,GLS,1252,Task Seating,With Arms,,    ,Medium Back,    ,TRUE
G1 Ergo Select,TS7332,High Back Heavy Duty ,GUS,1437,GLS,1278,Task Seating,With Arms,,    ,High Back,    ,TRUE
G1 Ergo Select,TS7333,Extended High Back Heavy Duty,GUS,1507,GLS,1302,Task Seating,With Arms,,    ,Extended High Back,    ,TRUE
Novello,6400,"Task, Upholstered Seat & Polypropylene Back",GUS,1576,GLS,956,Task Seating,With Arms,,Upholstered Back,    ,    ,TRUE
Novello,6401,"Armless Task, Upholstered Seat & Polypropylene Back ",GUS,1004,GLS,870,Task Seating,Armless,,Upholstered Back,    ,    ,TRUE
Novello,6402,"Task, Upholstered Seat & Back",GUS,909,GLS,1010,Task Seating,With Arms,,Upholstered Back,    ,    ,TRUE
Novello,6403,"Armless Task, Upholstered Seat & Back",GUS,1085,GLS,927,Task Seating,Armless,,Upholstered Back,    ,    ,TRUE
Novello,6410,"Height Adjustable Stool, Upholstered Seat & Polypropylene Back",GUS,998,GLS,1127,Stools,With Arms,,Upholstered Back,    ,    ,TRUE
Novello,6411,"Armless Height Adjustable Stool, Upholstered Seat & Polypropylene Back",GUS,1153,GLS,1042,Stools,Armless,,Upholstered Back,    ,    ,TRUE
Novello,6412,"Height Adjustable Stool, Upholstered Seat & Back",GUS,1056,GLS,1183,Stools,With Arms,,Upholstered Back,    ,    ,TRUE
Novello,6413,"Armless Height Adjustable Stool, Upholstered Seat & Back",GUS,1234,GLS,1099,Stools,Armless,,Upholstered Back,    ,    ,TRUE
Novello,6400PB,"Task Chair, Upholstered Seat & Polypropylene Back, Pedestal Base ",GUS,1138,GLS,1177,Pedestal,With Arms,Pedestal Base,Upholstered Back,    ,    ,TRUE
Novello,6401PB,"Armless Task Chair, Upholstered Seat & Polypropylene Back, Pedestal Base",GUS,1236,GLS,1094,Pedestal,Armless,Pedestal Base,Upholstered Back,    ,    ,TRUE
